{
  "version": "1.0",
  "generated_at": "2026-01-01T00:00:00Z",
  "categories": {
    "basic_usage": {
      "name": "Basic Usage",
      "description": "Essential patterns for getting started with the greeting API",
      "patterns": [
        "one_off_greeting",
        "reused_greeter"
      ]
    }
  },
  "patterns": [
    {
      "id": "one_off_greeting",
      "name": "One-off greeting",
      "description": "Greet a single name without keeping any state",
      "complexity": "beginner",
      "category": "basic_usage",
      "code": "from greet_miri import greet\n\nprint(greet(\"Ada\"))",
      "explanation": {
        "key_points": [
          "greet() constructs a Greeter internally, so there is no setup cost to manage",
          "The default language is 'en'; an unknown code falls back to English rather than raising"
        ]
      },
      "tags": [
        "quickstart"
      ],
      "antipatterns": [
        {
          "name": "Treating an unknown language code as an error",
          "wrong_code": "try:\n    greet(\"Ada\", language=\"zz\")\nexcept ValueError:\n    ...",
          "right_code": "greeting = greet(\"Ada\", language=\"zz\")  # falls back to English",
          "why": "An unrecognised language code falls back to English and never raises. Code that catches an exception here is dead, and code that relies on one is wrong.",
          "severity": "correctness"
        }
      ]
    },
    {
      "id": "reused_greeter",
      "name": "Reused greeter",
      "description": "Configure the language once and greet many names",
      "complexity": "beginner",
      "category": "basic_usage",
      "code": "from greet_miri import Greeter\n\ng = Greeter(language=\"es\")\nfor name in (\"Ada\", \"Alan\"):\n    print(g.greet(name))",
      "explanation": {
        "key_points": [
          "Prefer this over calling greet() in a loop when the language is fixed",
          "Greeter holds only its language, so instances are cheap and safe to reuse"
        ],
        "performance_note": "Greeter performs no I/O and allocates nothing per call; reuse is a readability choice, not a throughput one."
      },
      "prerequisites": [
        "one_off_greeting"
      ],
      "related_patterns": [
        "one_off_greeting"
      ],
      "tags": [
        "configuration"
      ],
      "antipatterns": [
        {
          "name": "Rebuilding Greeter inside a loop",
          "wrong_code": "for name in names:\n    print(Greeter(language=\"es\").greet(name))",
          "right_code": "g = Greeter(language=\"es\")\nfor name in names:\n    print(g.greet(name))",
          "why": "Constructing a Greeter per iteration re-does the language lookup for every name and obscures that the language is fixed for the whole loop.",
          "severity": "performance"
        }
      ]
    }
  ]
}
